{
  "schema_version": "0.7.0",
  "summary_stage": "preliminary",
  "source_documents": [
    {
      "doc_id": "SYN-PLAN-001",
      "name": "Synthetic Alpha Plan Document",
      "type": "synthetic plan document",
      "effective_date": "2001-01-01",
      "adoption_date": "2000-12-15",
      "notes": "Synthetic source for R5 drill only."
    }
  ],
  "items": [
    {
      "item_id": 1,
      "question": "What is the Adoption Date of the document?",
      "answer": "Synthetic answer for drill only covering normal retirement, early retirement, vesting, benefit formula, optional forms, and payment mechanics.",
      "citations": [
        {
          "doc_id": "SYN-PLAN-001",
          "page": 1,
          "locator": "Synthetic R5 item 1",
          "snippet": "Synthetic cited snippet for item 1."
        }
      ],
      "notes": "Synthetic drill item; not authoritative."
    },
    {
      "item_id": 2,
      "question": "What is the Plan Anniversary?",
      "answer": "Synthetic answer for drill only covering normal retirement, early retirement, vesting, benefit formula, optional forms, and payment mechanics.",
      "citations": [
        {
          "doc_id": "SYN-PLAN-001",
          "page": 1,
          "locator": "Synthetic R5 item 2",
          "snippet": "Synthetic cited snippet for item 2."
        }
      ],
      "notes": "Synthetic drill item; not authoritative."
    },
    {
      "item_id": 3,
      "question": "What are the groups of employees covered under the plan?",
      "answer": "Synthetic answer for drill only covering normal retirement, early retirement, vesting, benefit formula, optional forms, and payment mechanics.",
      "citations": [
        {
          "doc_id": "SYN-PLAN-001",
          "page": 1,
          "locator": "Synthetic R5 item 3",
          "snippet": "Synthetic cited snippet for item 3."
        }
      ],
      "notes": "Synthetic drill item; not authoritative."
    },
    {
      "item_id": 4,
      "question": "What are the participation eligibility requirements in the plan?",
      "answer": "Synthetic answer for drill only covering normal retirement, early retirement, vesting, benefit formula, optional forms, and payment mechanics.",
      "citations": [
        {
          "doc_id": "SYN-PLAN-001",
          "page": 2,
          "locator": "Synthetic R5 item 4",
          "snippet": "Synthetic cited snippet for item 4."
        }
      ],
      "notes": "Synthetic drill item; not authoritative."
    },
    {
      "item_id": 5,
      "question": "What is the participation date after attainment of eligibility in the plan?",
      "answer": "Synthetic answer for drill only covering normal retirement, early retirement, vesting, benefit formula, optional forms, and payment mechanics.",
      "citations": [
        {
          "doc_id": "SYN-PLAN-001",
          "page": 2,
          "locator": "Synthetic R5 item 5",
          "snippet": "Synthetic cited snippet for item 5."
        }
      ],
      "notes": "Synthetic drill item; not authoritative."
    },
    {
      "item_id": 6,
      "question": "What is the Age/Service retirement eligibility for normal retirement in the plan?",
      "answer": "Synthetic answer for drill only covering normal retirement, early retirement, vesting, benefit formula, optional forms, and payment mechanics.",
      "citations": [
        {
          "doc_id": "SYN-PLAN-001",
          "page": 2,
          "locator": "Synthetic R5 item 6",
          "snippet": "Synthetic cited snippet for item 6."
        }
      ],
      "notes": "Synthetic drill item; not authoritative."
    },
    {
      "item_id": 7,
      "question": "What is the Start Date for normal retirement in the plan?",
      "answer": "Synthetic answer for drill only covering normal retirement, early retirement, vesting, benefit formula, optional forms, and payment mechanics.",
      "citations": [
        {
          "doc_id": "SYN-PLAN-001",
          "page": 3,
          "locator": "Synthetic R5 item 7",
          "snippet": "Synthetic cited snippet for item 7."
        }
      ],
      "notes": "Synthetic drill item; not authoritative."
    },
    {
      "item_id": 8,
      "question": "What is the Age/Service retirement eligibility for Early Unreduced benefit retirement in the plan?",
      "answer": "Synthetic answer for drill only covering normal retirement, early retirement, vesting, benefit formula, optional forms, and payment mechanics.",
      "citations": [
        {
          "doc_id": "SYN-PLAN-001",
          "page": 3,
          "locator": "Synthetic R5 item 8",
          "snippet": "Synthetic cited snippet for item 8."
        }
      ],
      "notes": "Synthetic drill item; not authoritative."
    },
    {
      "item_id": 9,
      "question": "What is the Age/Service retirement eligibility for Early Reduced benefit retirement in the plan?",
      "answer": "unknown/na",
      "citations": [],
      "notes": "Synthetic drill item; not authoritative."
    },
    {
      "item_id": 10,
      "question": "What is the Start Date for early retirement in the plan?",
      "answer": "unknown/na",
      "citations": [],
      "notes": "Synthetic drill item; not authoritative."
    },
    {
      "item_id": 11,
      "question": "For Deferred vested, not eligible to retire as of date of termination, what is the Age/Service retirement eligibility for normal retirement in the plan?",
      "answer": "unknown/na",
      "citations": [],
      "notes": "Synthetic drill item; not authoritative."
    },
    {
      "item_id": 12,
      "question": "For Deferred vested, not eligible to retire as of date of termination, what is the Age/Service retirement eligibility for early retirement in the plan?",
      "answer": "unknown/na",
      "citations": [],
      "notes": "Synthetic drill item; not authoritative."
    },
    {
      "item_id": 13,
      "question": "What is the retirement eligibility for late retirement in the plan?",
      "answer": "unknown/na",
      "citations": [],
      "notes": "Synthetic drill item; not authoritative."
    },
    {
      "item_id": 14,
      "question": "What is the eligibility requirement for disability under the plan?",
      "answer": "unknown/na",
      "citations": [],
      "notes": "Synthetic drill item; not authoritative."
    },
    {
      "item_id": 15,
      "question": "How the plan defines Eligibility/Participation service?",
      "answer": "unknown/na",
      "citations": [],
      "notes": "Synthetic drill item; not authoritative."
    },
    {
      "item_id": 16,
      "question": "How the plan defines vesting service?",
      "answer": "unknown/na",
      "citations": [],
      "notes": "Synthetic drill item; not authoritative."
    },
    {
      "item_id": 17,
      "question": "How the plan defines benefit service?",
      "answer": "unknown/na",
      "citations": [],
      "notes": "Synthetic drill item; not authoritative."
    },
    {
      "item_id": 18,
      "question": "Does the plan defines other type of service besides eligibility/participation, vesting and benefit service?",
      "answer": "unknown/na",
      "citations": [],
      "notes": "Synthetic drill item; not authoritative."
    },
    {
      "item_id": 19,
      "question": "What is the accrued benefit formula under the plan?",
      "answer": "unknown/na",
      "citations": [],
      "notes": "Synthetic drill item; not authoritative."
    },
    {
      "item_id": 20,
      "question": "What is the Accrual factor in the accrued benefit formula?",
      "answer": "unknown/na",
      "citations": [],
      "notes": "Synthetic drill item; not authoritative."
    },
    {
      "item_id": 21,
      "question": "What is the Short service factor in the accrued benefit formula?",
      "answer": "unknown/na",
      "citations": [],
      "notes": "Synthetic drill item; not authoritative."
    },
    {
      "item_id": 22,
      "question": "What compensation is used in the accrued benefit formula?",
      "answer": "unknown/na",
      "citations": [],
      "notes": "Synthetic drill item; not authoritative."
    },
    {
      "item_id": 23,
      "question": "How the plan defines average compensation to use in the accrued benefit formula?",
      "answer": "unknown/na",
      "citations": [],
      "notes": "Synthetic drill item; not authoritative."
    },
    {
      "item_id": 24,
      "question": "What is the Covered Compensation for Integrated Plans?",
      "answer": "unknown/na",
      "citations": [],
      "notes": "Synthetic drill item; not authoritative."
    },
    {
      "item_id": 25,
      "question": "What is the Primary Insurance Amount (PIA) Offset in the plan?",
      "answer": "unknown/na",
      "citations": [],
      "notes": "Synthetic drill item; not authoritative."
    },
    {
      "item_id": 26,
      "question": "If the plan is a Cash-Balance plan, What is the Initial Account Balance in the plan?",
      "answer": "unknown/na",
      "citations": [],
      "notes": "Synthetic drill item; not authoritative."
    },
    {
      "item_id": 27,
      "question": "If the plan is a Cash-Balance plan, How the the plan defines Benefit Credit in the Cash Balance Account?",
      "answer": "unknown/na",
      "citations": [],
      "notes": "Synthetic drill item; not authoritative."
    },
    {
      "item_id": 28,
      "question": "If the plan is a Cash-Balance plan, How the the plan defines Interest Credit in the Cash Balance Account?",
      "answer": "unknown/na",
      "citations": [],
      "notes": "Synthetic drill item; not authoritative."
    },
    {
      "item_id": 29,
      "question": "If the plan is a Cash-Balance plan, What is the Timing of Interest Credit in the Cash Balance Account?",
      "answer": "unknown/na",
      "citations": [],
      "notes": "Synthetic drill item; not authoritative."
    },
    {
      "item_id": 30,